1,张小斐王嘉尔 又一对豪门姐弟,3769540
2,明年我国将全面普及道路客运电子客票,2391865
3,创4哥哥的稳嫩时刻,2130148
4,白敬亭说马思纯咬了他一口,2001242
5,周深不吃土豆丝的原因,1646958
6,成年人的世界没有愚人节 只有Q2,1641584
7,iOS14.5不再默认为女性语音,1605189
8,愚人节文案,1572264
9,司藤,1547643
10,王伟牺牲20周年,1506765
11,劝邻桌勿吸烟女子已获道歉赔偿,1484123
12,焦恩俊林千钰已离婚,1467093
13,汪东城晒接吻照表白,1456480
14,奚梦瑶,1425239
15,在沪停留超24小时需强制登记系误读,1401894
16,长歌行,1370557
17,陶昕然 女人离婚就要离家,1318878
18,姑娘坚持590天每天画一朵云,1306484
19,男子同时交20多名女朋友诈骗900多万,1152498
20,幼儿园男童呕吐后趴桌身亡,1112545
21,妻子的浪漫旅行5阵容,883469
22,陈伟霆出演邓紫棋超能力MV,622017
23,扫黑纪录片看傻了,606159
24,可口可乐将推出纸壳包装,556934
25,云南新增23例无症状感染者,556508
26,庄神受伤,556250
27,张小斐 美女不要总扯肩带,556117
28,五百万够普通家庭用多久,549591
29,燃油车不得占用充电专用车位,513410
30,马斯克回应SpaceX星舰爆炸,498851
31,中科院化学所发生爆炸,498014
32,看完眼科后的社死瞬间,374673
33,韩国30至39岁未婚者超半数啃老,295331
34,为了省电在厨房装声控灯,278880
35,尹弘同志任甘肃省委书记,272050
36,当众求婚算道德绑架吗,266501
37,我的姐姐中国式家庭特辑,265565
38,李现看到杨紫穿马丁靴比了个赞,251628
39,窥探,181477
40,在王伟烈士墓前留信的人找到了,163000
41,普通人的财富自由门槛多少钱算合理,139026
42,利刃出鞘将拍两部续集,120796
43,瑞丽完成全员核酸采样,119461
44,吴磊荷尔蒙,116433
45,张韶涵卡斯柏新歌MV,115815
46,骑手与商家有矛盾在奶茶中放牙签,114110
47,多地樱花大道惊艳开放,111617
48,布克45分,109855
49,王伟的夙愿实现了,104817
50,夏达 长歌行,104588
